### ISSUE TITLE
Could not connect to your node with those details

### ISSUE THREAD

**Issue by ulrichard** [LN-Juggernaut/juggernaut-desktop#66]
After upgrading my raspiblitz, I should now be able to use juggernaut with it. But when I enter all the information, and click the save button, I get the error: "Could not connect to your node with those details"
I tried all three Macaroons that I got from the raspiblitz (admin, invoice, readonly). 
I tried pasting the macaroon and tls cert as hex into the fields as well as scp from the raspi and enter the file names into the fields.
I was not sure what to use for port. So I tried with 10009, 8080, 9735 and without specifying a port.
 
## Expected Behavior
It should establish a connection with the node.

## Current Behavior
I get the error: "Could not connect to your node with those details"

## Your Environment
Node: https://github.com/rootzoll/raspiblitz
RaspiBlitz v1.5
bitcoin v0.19.1
LND 0.9.2-beta
The public address of the lightning node is an onion address
Accept Keysend is enabled

Client: Ubuntu 18.04
Juggernaut-linux-x86_64-v0.1.1.AppImage

Both on the same subnet

**Comment by bereska** [comment]
same here, lnd 0.10.99-beta

**Comment by beeforbacon** [comment]
same issue. Tried in both LNDCONNECT and manual. lnd 0.10.99-beta. worked fine previously. My LND installation is from source on custom ubuntu based machine.

**Comment by VitaminB21** [comment]
Same here

First installation 

RaspiBlitz V 1.5
lnd 0.10.0 beta

**Comment by amcitaly** [comment]
same here, with mynodebtc it works, just copy the LNDCONNECT file and is immediately on, with raspiblitz seem more complicate to set up (manual) and I didn't manage to do it

**Comment by amcitaly** [comment]
I have manage to connect the raspiblitz to Juggernaut with the file lndconnect, my file was pointing the wrong address (the external IP) I have correct it manually with the internal IP assigned to the raspi at the beginning, I have found that also with zap didn't work for the same issue. 
Example here of the beginning of the lndconnect file:

lndconnect://X.XXX.XXX.X:10009?cert=.... **to change with** lndconnect://192.168.1.77:10009?cert=

(i change my public ip with the XXX for privacy)

**Comment by beeforbacon** [comment]
> 
> 
> I have manage to connect the raspiblitz to Juggernaut with the file lndconnect, my file was pointing the wrong address (the external IP) I have correct it manually with the internal IP assigned to the raspi at the beginning, I have found that also with zap didn't work for the same issue.
> Example here of the beginning of the lndconnect file:
> 
> lndconnect://X.XXX.XXX.X:10009?cert=.... **to change with** lndconnect://192.168.1.77:10009?cert=
> 
> (i change my public ip with the XXX for privacy)

Local IP gives same error for me. I am happy it worked for you though!

**Comment by githorray** [comment]
also cannot connect.

$ lnd --version
lnd version 0.10.99-beta commit=clock/v1.0.0-229-ge64e71d86dc1ac716c30a80f85a22e8fb544697f

```
01:53:54.415080 IP 127.0.0.1.36794 > 127.0.0.1.10009: Flags [S], seq 3420441938, win 65495, options [mss 65495,sackOK,TS val 1707137647 ecr 0,nop,wscale 7], length 0
01:53:54.415090 IP 127.0.0.1.10009 > 127.0.0.1.36794: Flags [S.], seq 1369118690, ack 3420441939, win 65483, options [mss 65495,sackOK,TS val 1707137647 ecr 1707137647,nop,wscale 7], length 0
01:53:54.415099 IP 127.0.0.1.36794 > 127.0.0.1.10009: Flags [.], ack 1, win 512, options [nop,nop,TS val 1707137647 ecr 1707137647], length 0
01:53:54.418248 IP 127.0.0.1.36794 > 127.0.0.1.10009: Flags [P.], seq 1:258, ack 1, win 512, options [nop,nop,TS val 1707137650 ecr 1707137647], length 257
01:53:54.418260 IP 127.0.0.1.10009 > 127.0.0.1.36794: Flags [.], ack 258, win 510, options [nop,nop,TS val 1707137650 ecr 1707137650], length 0
01:53:54.740572 IP 127.0.0.1.10009 > 127.0.0.1.36794: Flags [P.], seq 1:1060, ack 258, win 512, options [nop,nop,TS val 1707137972 ecr 1707137650], length 1059
01:53:54.740587 IP 127.0.0.1.36794 > 127.0.0.1.10009: Flags [.], ack 1060, win 504, options [nop,nop,TS val 1707137972 ecr 1707137972], length 0
01:53:54.743899 IP 127.0.0.1.36794 > 127.0.0.1.10009: Flags [P.], seq 258:322, ack 1060, win 512, options [nop,nop,TS val 1707137976 ecr 1707137972], length 64
01:53:54.743916 IP 127.0.0.1.10009 > 127.0.0.1.36794: Flags [.], ack 322, win 512, options [nop,nop,TS val 1707137976 ecr 1707137976], length 0
01:53:54.743985 IP 127.0.0.1.36794 > 127.0.0.1.10009: Flags [P.], seq 322:377, ack 1060, win 512, options [nop,nop,TS val 1707137976 ecr 1707137976], length 55
01:53:54.743989 IP 127.0.0.1.10009 > 127.0.0.1.36794: Flags [.], ack 377, win 512, options [nop,nop,TS val 1707137976 ecr 1707137976], length 0
01:53:54.749803 IP 127.0.0.1.36794 > 127.0.0.1.10009: Flags [P.], seq 377:572, ack 1060, win 512, options [nop,nop,TS val 1707137982 ecr 1707137976], length 195
01:53:54.749827 IP 127.0.0.1.10009 > 127.0.0.1.36794: Flags [.], ack 572, win 511, options [nop,nop,TS val 1707137982 ecr 1707137982], length 0
01:53:54.750802 IP 127.0.0.1.36794 > 127.0.0.1.10009: Flags [P.], seq 572:603, ack 1060, win 512, options [nop,nop,TS val 1707137983 ecr 1707137982], length 31
01:53:54.750820 IP 127.0.0.1.10009 > 127.0.0.1.36794: Flags [.], ack 603, win 511, options [nop,nop,TS val 1707137983 ecr 1707137983], length 0
01:53:54.903224 IP 127.0.0.1.10009 > 127.0.0.1.36794: Flags [P.], seq 1060:1128, ack 603, win 512, options [nop,nop,TS val 1707138135 ecr 1707137983], length 68
01:53:54.903235 IP 127.0.0.1.36794 > 127.0.0.1.10009: Flags [.], ack 1128, win 512, options [nop,nop,TS val 1707138135 ecr 1707138135], length 0
01:53:54.903399 IP 127.0.0.1.36794 > 127.0.0.1.10009: Flags [P.], seq 603:634, ack 1128, win 512, options [nop,nop,TS val 1707138135 ecr 1707138135], length 31
01:53:54.903408 IP 127.0.0.1.10009 > 127.0.0.1.36794: Flags [.], ack 634, win 512, options [nop,nop,TS val 1707138135 ecr 1707138135], length 0
01:53:54.908825 IP 127.0.0.1.10009 > 127.0.0.1.36794: Flags [P.], seq 1128:1285, ack 634, win 512, options [nop,nop,TS val 1707138141 ecr 1707138135], length 157
01:53:54.908837 IP 127.0.0.1.36794 > 127.0.0.1.10009: Flags [.], ack 1285, win 511, options [nop,nop,TS val 1707138141 ecr 1707138141], length 0
01:53:54.911383 IP 127.0.0.1.36794 > 127.0.0.1.10009: Flags [P.], seq 634:673, ack 1285, win 512, options [nop,nop,TS val 1707138143 ecr 1707138141], length 39
01:53:54.911398 IP 127.0.0.1.10009 > 127.0.0.1.36794: Flags [.], ack 673, win 512, options [nop,nop,TS val 1707138143 ecr 1707138143], length 0
01:53:54.980687 IP 127.0.0.1.36796 > 127.0.0.1.10009: Flags [S], seq 1898668504, win 65495, options [mss 65495,sackOK,TS val 1707138213 ecr 0,nop,wscale 7], length 0
01:53:54.980702 IP 127.0.0.1.10009 > 127.0.0.1.36796: Flags [S.], seq 1347235886, ack 1898668505, win 65483, options [mss 65495,sackOK,TS val 1707138213 ecr 1707138213,nop,wscale 7], length 0
01:53:54.980715 IP 127.0.0.1.36796 > 127.0.0.1.10009: Flags [.], ack 1, win 512, options [nop,nop,TS val 1707138213 ecr 1707138213], length 0
01:53:54.980957 IP 127.0.0.1.36796 > 127.0.0.1.10009: Flags [P.], seq 1:258, ack 1, win 512, options [nop,nop,TS val 1707138213 ecr 1707138213], length 257
01:53:54.980964 IP 127.0.0.1.10009 > 127.0.0.1.36796: Flags [.], ack 258, win 510, options [nop,nop,TS val 1707138213 ecr 1707138213], length 0
01:53:55.299025 IP 127.0.0.1.10009 > 127.0.0.1.36796: Flags [P.], seq 1:1059, ack 258, win 512, options [nop,nop,TS val 1707138531 ecr 1707138213], length 1058
01:53:55.299037 IP 127.0.0.1.36796 > 127.0.0.1.10009: Flags [.], ack 1059, win 504, options [nop,nop,TS val 1707138531 ecr 1707138531], length 0
01:53:55.301604 IP 127.0.0.1.36796 > 127.0.0.1.10009: Flags [P.], seq 258:322, ack 1059, win 512, options [nop,nop,TS val 1707138533 ecr 1707138531], length 64
01:53:55.301624 IP 127.0.0.1.10009 > 127.0.0.1.36796: Flags [.], ack 322, win 512, options [nop,nop,TS val 1707138533 ecr 1707138533], length 0
01:53:55.301664 IP 127.0.0.1.36796 > 127.0.0.1.10009: Flags [P.], seq 322:377, ack 1059, win 512, options [nop,nop,TS val 1707138534 ecr 1707138533], length 55
01:53:55.301670 IP 127.0.0.1.10009 > 127.0.0.1.36796: Flags [.], ack 377, win 512, options [nop,nop,TS val 1707138534 ecr 1707138534], length 0
01:53:55.304283 IP 127.0.0.1.36796 > 127.0.0.1.10009: Flags [P.], seq 377:947, ack 1059, win 512, options [nop,nop,TS val 1707138536 ecr 1707138534], length 570
01:53:55.304302 IP 127.0.0.1.10009 > 127.0.0.1.36796: Flags [.], ack 947, win 508, options [nop,nop,TS val 1707138536 ecr 1707138536], length 0
01:53:55.304661 IP 127.0.0.1.36796 > 127.0.0.1.10009: Flags [P.], seq 947:978, ack 1059, win 512, options [nop,nop,TS val 1707138537 ecr 1707138536], length 31
01:53:55.304672 IP 127.0.0.1.10009 > 127.0.0.1.36796: Flags [.], ack 978, win 508, options [nop,nop,TS val 1707138537 ecr 1707138537], length 0
01:53:55.461158 IP 127.0.0.1.10009 > 127.0.0.1.36796: Flags [P.], seq 1059:1127, ack 978, win 512, options [nop,nop,TS val 1707138693 ecr 1707138537], length 68
01:53:55.461172 IP 127.0.0.1.36796 > 127.0.0.1.10009: Flags [.], ack 1127, win 512, options [nop,nop,TS val 1707138693 ecr 1707138693], length 0
01:53:55.461267 IP 127.0.0.1.36796 > 127.0.0.1.10009: Flags [P.], seq 978:1009, ack 1127, win 512, options [nop,nop,TS val 1707138693 ecr 1707138693], length 31
01:53:55.461277 IP 127.0.0.1.10009 > 127.0.0.1.36796: Flags [.], ack 1009, win 512, options [nop,nop,TS val 1707138693 ecr 1707138693], length 0
01:53:55.472152 IP 127.0.0.1.10009 > 127.0.0.1.36796: Flags [P.], seq 1127:1950, ack 1009, win 512, options [nop,nop,TS val 1707138704 ecr 1707138693], length 823
01:53:55.472163 IP 127.0.0.1.36796 > 127.0.0.1.10009: Flags [.], ack 1950, win 506, options [nop,nop,TS val 1707138704 ecr 1707138704], length 0
01:53:55.473486 IP 127.0.0.1.36796 > 127.0.0.1.10009: Flags [P.], seq 1009:1048, ack 1950, win 512, options [nop,nop,TS val 1707138705 ecr 1707138704], length 39
01:53:55.473498 IP 127.0.0.1.10009 > 127.0.0.1.36796: Flags [.], ack 1048, win 512, options [nop,nop,TS val 1707138705 ecr 1707138705], length 0
01:53:55.481936 IP 127.0.0.1.36794 > 127.0.0.1.10009: Flags [P.], seq 673:729, ack 1285, win 512, options [nop,nop,TS val 1707138714 ecr 1707138143], length 56
01:53:55.481949 IP 127.0.0.1.10009 > 127.0.0.1.36794: Flags [.], ack 729, win 512, options [nop,nop,TS val 1707138714 ecr 1707138714], length 0
01:53:55.482517 IP 127.0.0.1.36794 > 127.0.0.1.10009: Flags [F.], seq 729, ack 1285, win 512, options [nop,nop,TS val 1707138714 ecr 1707138714], length 0
01:53:55.522625 IP 127.0.0.1.10009 > 127.0.0.1.36794: Flags [.], ack 730, win 512, options [nop,nop,TS val 1707138754 ecr 1707138714], length 0
01:53:55.641931 IP 127.0.0.1.10009 > 127.0.0.1.36794: Flags [P.], seq 1285:1309, ack 730, win 512, options [nop,nop,TS val 1707138874 ecr 1707138714], length 24
01:53:55.641943 IP 127.0.0.1.36794 > 127.0.0.1.10009: Flags [R], seq 3420442668, win 0, length 0
```

**Comment by githorray** [comment]
I found out the issue was that the hostname I was using was not in the tls.cert file. working ok now with an included hostname.

You can list them with the following command.

`sed -ne 's/^\( *\)Subject:/\1/p;/X509v3 Subject Alternative Name/{N;s/^.*\n//;:a;s/^\( *\)\(.*\), /\1\2\n\1/;ta;p;q; }' < <(openssl x509 -in ~/.lnd/tls.cert -noout -text)`

**Comment by githorray** [comment]
Error connecting on the latest lnd master.

```
$ lnd --version
lnd version 0.11.99-beta commit=v0.11.0-beta-83-g751b02361e53a56d3eb56085342c5d6dcc7d928c
```

```
Failed to launch node
Please make sure you are connected to the internet and your node is online
```

**Comment by davterra** [comment]
Same issue persists using myNode and trying every conceivable connection script. I have to assume this project is dead for now, at least...as this critical issue has been open for 6 months, and that's about how long it appears since there's been any updates or merges in the repo. 
Really too bad.....unless something new/improved is about to be unveiled. This was a great idea that worked well early on.
